[
  {
    "event_id": "evt-001",
    "run_id": "run-fixture-001",
    "event_type": "message.delta",
    "occurred_at": "2026-01-01T00:00:01Z",
    "seq": 1,
    "payload": {"message_delta": "Hello"},
    "metadata": {"source": "fixture"}
  },
  {
    "event_id": "evt-002",
    "run_id": "run-fixture-001",
    "event_type": "message.completed",
    "occurred_at": "2026-01-01T00:00:02Z",
    "seq": 2,
    "payload": {"message_delta": "Hello, lawyer!"},
    "metadata": {"source": "fixture"}
  },
  {
    "event_id": "evt-003",
    "run_id": "run-fixture-001",
    "event_type": "thought.delta",
    "occurred_at": "2026-01-01T00:00:03Z",
    "seq": 3,
    "payload": {"text": "Analyzing the legal question..."},
    "metadata": {"source": "fixture"}
  },
  {
    "event_id": "evt-004",
    "run_id": "run-fixture-001",
    "event_type": "tool_call.started",
    "occurred_at": "2026-01-01T00:00:04Z",
    "seq": 4,
    "payload": {"tool_name": "law_search", "tool_call_id": "tc-001"},
    "metadata": {"source": "fixture"}
  },
  {
    "event_id": "evt-005",
    "run_id": "run-fixture-001",
    "event_type": "run.state_changed",
    "occurred_at": "2026-01-01T00:00:05Z",
    "seq": 5,
    "payload": {"status": "succeeded"},
    "metadata": {"source": "fixture"}
  }
]
