[
  {
    "event_id": "evt-001",
    "run_id": "run-integration-001",
    "event_type": "session.started",
    "occurred_at": "2026-01-01T00:00:01Z",
    "seq": 1,
    "payload": {"session_id": "session-example-001", "tenant_id": "tenant-example"},
    "metadata": {"source": "fixture"}
  },
  {
    "event_id": "evt-002",
    "run_id": "run-integration-001",
    "event_type": "message.delta",
    "occurred_at": "2026-01-01T00:00:02Z",
    "seq": 2,
    "payload": {"message_delta": "Hello"},
    "metadata": {"source": "fixture"}
  },
  {
    "event_id": "evt-003",
    "run_id": "run-integration-001",
    "event_type": "message.delta",
    "occurred_at": "2026-01-01T00:00:03Z",
    "seq": 3,
    "payload": {"message_delta": ", lawyer!"},
    "metadata": {"source": "fixture"}
  },
  {
    "event_id": "evt-004",
    "run_id": "run-integration-001",
    "event_type": "message.delta",
    "occurred_at": "2026-01-01T00:00:04Z",
    "seq": 4,
    "payload": {"message_delta": " I will help you."},
    "metadata": {"source": "fixture"}
  },
  {
    "event_id": "evt-005",
    "run_id": "run-integration-001",
    "event_type": "thought.delta",
    "occurred_at": "2026-01-01T00:00:05Z",
    "seq": 5,
    "payload": {"text": "Analyzing the question..."},
    "metadata": {"source": "fixture"}
  },
  {
    "event_id": "evt-006",
    "run_id": "run-integration-001",
    "event_type": "tool_call.started",
    "occurred_at": "2026-01-01T00:00:06Z",
    "seq": 6,
    "payload": {"tool_name": "law_search", "tool_call_id": "tc-001"},
    "metadata": {"source": "fixture"}
  },
  {
    "event_id": "evt-007",
    "run_id": "run-integration-001",
    "event_type": "tool_call.delta",
    "occurred_at": "2026-01-01T00:00:07Z",
    "seq": 7,
    "payload": {"tool_call_id": "tc-001", "delta": "searching..."},
    "metadata": {"source": "fixture"}
  },
  {
    "event_id": "evt-008",
    "run_id": "run-integration-001",
    "event_type": "tool_call.completed",
    "occurred_at": "2026-01-01T00:00:08Z",
    "seq": 8,
    "payload": {"tool_call_id": "tc-001", "result_ref": "ref://search/tc-001/result"},
    "metadata": {"source": "fixture"}
  },
  {
    "event_id": "evt-009",
    "run_id": "run-integration-001",
    "event_type": "message.completed",
    "occurred_at": "2026-01-01T00:00:09Z",
    "seq": 9,
    "payload": {"message_delta": "Hello, lawyer! I will help you."},
    "metadata": {"source": "fixture"}
  },
  {
    "event_id": "evt-010",
    "run_id": "run-integration-001",
    "event_type": "plan.updated",
    "occurred_at": "2026-01-01T00:00:10Z",
    "seq": 10,
    "payload": {"plan": {"steps": ["analyze", "search", "draft"]}},
    "metadata": {"source": "fixture"}
  },
  {
    "event_id": "evt-011",
    "run_id": "run-integration-001",
    "event_type": "phase.changed",
    "occurred_at": "2026-01-01T00:00:11Z",
    "seq": 11,
    "payload": {"phase": "draft"},
    "metadata": {"source": "fixture"}
  },
  {
    "event_id": "evt-012",
    "run_id": "run-integration-001",
    "event_type": "elicitation.requested",
    "occurred_at": "2026-01-01T00:00:12Z",
    "seq": 12,
    "payload": {"questions": [{"id": "q1", "text": "Which party?", "allow_multiple": false}]},
    "metadata": {"source": "fixture"}
  },
  {
    "event_id": "evt-013",
    "run_id": "run-integration-001",
    "event_type": "artifact.created",
    "occurred_at": "2026-01-01T00:00:13Z",
    "seq": 13,
    "payload": {"artifact_id": "artifact-example-001", "kind": "trackchanges_docx", "uri_ref": "fixture://artifacts/artifact-example-001"},
    "metadata": {"source": "fixture"}
  },
  {
    "event_id": "evt-014",
    "run_id": "run-integration-001",
    "event_type": "citation.recorded",
    "occurred_at": "2026-01-01T00:00:14Z",
    "seq": 14,
    "payload": {"citation_id": "cit-001", "status": "verified", "source_ref": "ref://search/tc-001/result"},
    "metadata": {"source": "fixture"}
  },
  {
    "event_id": "evt-015",
    "run_id": "run-integration-001",
    "event_type": "run.state_changed",
    "occurred_at": "2026-01-01T00:00:15Z",
    "seq": 15,
    "payload": {"status": "succeeded"},
    "metadata": {"source": "fixture"}
  }
]
